{
  "schemaVersion": "1.0.0",
  "rack": {
    "id": "rack:learning-sciences-initial",
    "version": "0.1.0",
    "title": "Initial learning-sciences and pedagogy knowledge rack",
    "status": "draft",
    "createdAt": "2026-08-30",
    "scope": "A cross-lifespan, cross-domain retrieval source for pedagogical specialist agents; it is intentionally incomplete and designed for revision.",
    "nonPolicyNotice": "These records are candidates for retrieval and review, not kernel rules. An agent must check learner evidence, task fit, context, permissions, and contraindications before recommending or instantiating a tactic."
  },
  "evidenceScale": {
    "strong": "Convergent direct evidence or an evidence-rated institutional practice guide supports the bounded claim.",
    "context-dependent": "Evidence is positive or plausible but materially moderated by population, content, implementation, comparator, or outcome.",
    "hypothesis": "A useful explanatory or design hypothesis whose predicted ordering or mechanism is not established as a general causal rule.",
    "contested": "Credible reviews disagree, effects are small or heterogeneous, or popular claims exceed the evidence.",
    "refuted": "The proposed instructional benefit lacks the required interaction evidence or is contradicted by adequate tests.",
    "normative-standard": "An authoritative design, fairness, or accessibility standard; this is not an intervention effect estimate."
  },
  "recommendationScale": {
    "candidate-default-with-fit-check": "Usually worth considering inside its evidence boundary, but still requires task and learner fit checks.",
    "contextual-option": "Retrieve as an option only when stated prerequisites and boundary conditions are present.",
    "experimental-only": "Use only as an explicitly provisional design with measurement and review.",
    "do-not-generalize": "Do not convert the broad label into an achievement claim or default policy.",
    "avoid": "Do not use as a learner classification or instructional matching policy."
  },
  "sources": [
    {"id":"source:hpl2","title":"How People Learn II: Learners, Contexts, and Cultures","authorsOrInstitution":"National Academies of Sciences, Engineering, and Medicine","year":2018,"type":"consensus-report","url":"https://doi.org/10.17226/24783","doi":"10.17226/24783","authority":"institutional-consensus","notes":"Cross-lifespan synthesis; emphasizes prior knowledge, development, culture, motivation, memory, and contextual moderators."},
    {"id":"source:ies-study","title":"Organizing Instruction and Study to Improve Student Learning","authorsOrInstitution":"Institute of Education Sciences, What Works Clearinghouse","year":2007,"type":"practice-guide","url":"https://ies.ed.gov/ncee/wwc/PracticeGuide/1","authority":"institutional-evidence-synthesis","notes":"Evidence-rated guidance on spacing, examples, representations, quizzing, metacognition, and explanatory questions."},
    {"id":"source:retrieval-meta","title":"Classroom testing and retrieval practice: a meta-analysis","authorsOrInstitution":"Yang, Luo, Vadillo, Yu, and Shanks","year":2021,"type":"meta-analysis","url":"https://doi.org/10.1037/bul0000309","doi":"10.1037/bul0000309","authority":"primary-peer-reviewed","notes":"222 independent classroom studies; corrective feedback and design features moderate effects."},
    {"id":"source:spacing-meta","title":"Distributed practice in verbal recall tasks: A review and quantitative synthesis","authorsOrInstitution":"Cepeda, Pashler, Vul, Wixted, and Rohrer","year":2006,"type":"meta-analysis","url":"https://doi.org/10.1037/0033-2909.132.3.354","doi":"10.1037/0033-2909.132.3.354","authority":"primary-peer-reviewed"},
    {"id":"source:interleaving-meta","title":"Similarity matters: A meta-analysis of interleaved learning and its moderators","authorsOrInstitution":"Brunmair and Richter","year":2019,"type":"meta-analysis","url":"https://doi.org/10.1037/bul0000209","doi":"10.1037/bul0000209","authority":"primary-peer-reviewed","notes":"Benefits vary by material; expository text was nonsignificant and word learning favored blocking."},
    {"id":"source:cognitive-load","title":"Cognitive Architecture and Instructional Design: 20 Years Later","authorsOrInstitution":"Sweller, van Merrienboer, and Paas","year":2019,"type":"systematic-review","url":"https://doi.org/10.1007/s10648-019-09465-5","doi":"10.1007/s10648-019-09465-5","authority":"primary-peer-reviewed"},
    {"id":"source:worked-examples-meta","title":"A meta-analysis of worked examples in mathematics","authorsOrInstitution":"Barbieri and colleagues","year":2023,"type":"meta-analysis","url":"https://doi.org/10.1007/s10648-023-09745-1","doi":"10.1007/s10648-023-09745-1","authority":"primary-peer-reviewed"},
    {"id":"source:scaffolding-review","title":"Scaffolding in Teacher-Student Interaction: A Decade of Research","authorsOrInstitution":"van de Pol, Volman, and Beishuizen","year":2010,"type":"systematic-review","url":"https://doi.org/10.1007/s10648-010-9127-6","doi":"10.1007/s10648-010-9127-6","authority":"primary-peer-reviewed"},
    {"id":"source:feedback-meta","title":"The effects of feedback interventions on performance: A historical review, a meta-analysis, and a preliminary feedback intervention theory","authorsOrInstitution":"Kluger and DeNisi","year":1996,"type":"meta-analysis","url":"https://doi.org/10.1037/0033-2909.119.2.254","doi":"10.1037/0033-2909.119.2.254","authority":"primary-peer-reviewed","notes":"Average benefit with large heterogeneity; more than one third of interventions reduced performance."},
    {"id":"source:metacognition-meta","title":"Long-term effects of metacognitive strategy instruction on student academic performance","authorsOrInstitution":"de Boer, Donker, Kostons, and van der Werf","year":2018,"type":"meta-analysis","url":"https://doi.org/10.1016/j.edurev.2018.03.002","doi":"10.1016/j.edurev.2018.03.002","authority":"primary-peer-reviewed"},
    {"id":"source:transfer-taxonomy","title":"When and where do we apply what we learn? A taxonomy for far transfer","authorsOrInstitution":"Barnett and Ceci","year":2002,"type":"systematic-review","url":"https://doi.org/10.1037/0033-2909.128.4.612","doi":"10.1037/0033-2909.128.4.612","authority":"primary-peer-reviewed"},
    {"id":"source:icap","title":"The ICAP Framework: Linking Cognitive Engagement to Active Learning Outcomes","authorsOrInstitution":"Chi and Wylie","year":2014,"type":"framework","url":"https://doi.org/10.1080/00461520.2014.965823","doi":"10.1080/00461520.2014.965823","authority":"primary-peer-reviewed"},
    {"id":"source:productive-failure-meta","title":"When problem solving followed by instruction works: Evidence for productive failure","authorsOrInstitution":"Sinha and Kapur","year":2021,"type":"meta-analysis","url":"https://doi.org/10.3102/00346543211019105","doi":"10.3102/00346543211019105","authority":"primary-peer-reviewed","notes":"Benefits were bounded: conceptual knowledge and transfer, adequate prior knowledge, and explicit consolidation; younger grade estimates were negative."},
    {"id":"source:formative-review","title":"Assessment and Classroom Learning","authorsOrInstitution":"Black and Wiliam","year":1998,"type":"systematic-review","url":"https://doi.org/10.1080/0969595980050102","doi":"10.1080/0969595980050102","authority":"primary-peer-reviewed"},
    {"id":"source:formative-critique","title":"Formative assessment: a critical review","authorsOrInstitution":"Randy Elliot Bennett","year":2011,"type":"systematic-review","url":"https://doi.org/10.1080/0969594X.2010.513678","doi":"10.1080/0969594X.2010.513678","authority":"primary-peer-reviewed","notes":"Definitions and implementations are heterogeneous; broad magnitude claims need caution."},
    {"id":"source:motivation-meta","title":"A systematic review and meta-analysis of self-determination-theory-based interventions in education","authorsOrInstitution":"Wang, Wang, Wang, Wind, and Gill","year":2024,"type":"meta-analysis","url":"https://doi.org/10.1016/j.lmot.2024.102015","doi":"10.1016/j.lmot.2024.102015","authority":"primary-peer-reviewed"},
    {"id":"source:collaboration-meta","title":"A meta-analysis of the effects of face-to-face cooperative learning","authorsOrInstitution":"Kyndt and colleagues","year":2013,"type":"meta-analysis","url":"https://doi.org/10.1016/j.edurev.2013.02.002","doi":"10.1016/j.edurev.2013.02.002","authority":"primary-peer-reviewed"},
    {"id":"source:growth-mindset-meta","title":"Do growth mindset interventions impact students' academic achievement?","authorsOrInstitution":"Macnamara and Burgoyne","year":2023,"type":"meta-analysis","url":"https://doi.org/10.1037/bul0000352","doi":"10.1037/bul0000352","authority":"primary-peer-reviewed","notes":"High-quality subsets and publication-bias adjustments did not support general achievement effects."},
    {"id":"source:deliberate-practice-meta","title":"Deliberate Practice and Performance in Music, Games, Sports, Education, and Professions","authorsOrInstitution":"Macnamara, Hambrick, and Oswald","year":2014,"type":"meta-analysis","url":"https://doi.org/10.1177/0956797614535810","doi":"10.1177/0956797614535810","authority":"primary-peer-reviewed","notes":"Practice explained sharply different proportions of performance variance across domains and was not a complete account of expertise."},
    {"id":"source:learning-styles","title":"Learning Styles: Concepts and Evidence","authorsOrInstitution":"Pashler, McDaniel, Rohrer, and Bjork","year":2008,"type":"systematic-review","url":"https://doi.org/10.1111/j.1539-6053.2009.01038.x","doi":"10.1111/j.1539-6053.2009.01038.x","authority":"primary-peer-reviewed"},